{
  "person": "Alex Ionescu",
  "dimension": "公开作品与技术演化",
  "identity_check": "身份已通过其个人站点 https://www.alex-ionescu.com/ 与 GitHub https://github.com/ionescu007 两处一手来源交叉确认：博客 tagline 为 \"Windows Internals, Thoughts on Security, and Reverse Engineering\"，Twitter 标识 @aionescu；GitHub 个人简介标注 \"CTIO at CrowdStrike\" 与 \"President of Winsider Seminars & Solutions, Inc.\"，与人物记录中的 primary_focus（Windows 内核与平台漏洞）和 writeup_evidence（alex-ionescu.com）一致。同名歧义风险低，未发现指向不同个体的混淆材料。person_json 中标注的 \"Black Hat US/EU / BlueHat\" 会议经历在主站可见页面未直接列出会议页（/publications 为跳转页，指向 GitHub 与博客分类），尚无独立可抓取来源核证；ReactOS 早期项目角色亦未在主站提及，留作缺口。",
  "items": [
    {
      "id": "ai-works-01",
      "date": "2017-05-11",
      "claim": "在 Windows Internals 7th Edition（Part 1）发布博文中记述合著过程：在 Windows 7 版（第 6 版）基础上、12 个月工作后完成 Windows 10 版，并说明 Mark Russinovich 转 Azure 任 CTO、David Solomon 退休退出培训业务等合著者变动；对他人此前将其排除在外的三卷重写方案明确表示未参与。",
      "status": "unknown",
      "growth_signal": "长期合著权威参考书形成系统性内核结构认知，为后续独立技术发现（如 call-gate 系列源自 7th Edition 写作副产物）提供知识基线；写作周期 12 个月且需协调多人变动，反映其方法依赖于对系统结构的连续复盘而非单点突破。",
      "source": {
        "title": "Windows Internals, 7th Edition!",
        "url": "https://www.alex-ionescu.com/windows-internals-7th-edition/",
        "published": "2017-05-11",
        "source_type": "blog_post",
        "level": "lead_only"
      },
      "verification": {
        "verified_in_run": false,
        "retrieval_method": "unverified",
        "tool_use_id": "",
        "accessed_at": "",
        "content_sha256": ""
      }
    },
    {
      "id": "ai-works-02",
      "date": "2017-08-07",
      "claim": "在 \"Bringing Call Gates Back\" 中展示 x64 长模式下 LDT/call-gate 仍可用的提权技术路径（LDT 段描述符改写、LdtSystemDescriptor 篡改、GDT 懒清除等），明确指出该发现来自为 Windows Internals 7th Edition 研究 UMS（用户态调度）时的副产品，并称其并非 \"漏洞/0day\" 而是 CPU、系统与 OS 内部结构的组合利用。",
      "status": "documented",
      "growth_signal": "技术发现源于权威资料写作过程中的结构化审阅（UMS 触及 GS 段、LDT、KPROCESS 字段），方法链为\"写书→发现遗留机制→转化为提权原语\"；主动承接 j00ru 与 Gynvael Coldwind 的既有 LDT 滥用研究并扩展到 x64，体现基于前人工作的迭代而非孤立发现。",
      "short_quote": "there is no 'vulnerability' or 'zero-day' presented here",
      "source": {
        "title": "Bringing Call Gates Back",
        "url": "https://www.alex-ionescu.com/bringing-call-gates-back/",
        "published": "2017-08-07",
        "source_type": "blog_post",
        "level": "primary"
      },
      "verification": {
        "verified_in_run": true,
        "retrieval_method": "web_fetch",
        "tool_use_id": "call_c0jzkzfjs3e57q6gpt7us8p0",
        "accessed_at": "2026-09-27T06:57:34.773542+00:00",
        "content_sha256": "81c4b6e00d64658265dae4597f0135f042bc45f25b7354bf8250e5e1e0196248"
      }
    },
    {
      "id": "ai-works-03",
      "date": "2018-08-02",
      "claim": "在 \"Dynamic Tracing in Windows 10 19H1\" 中记录 19H1 引入的内核动态追踪能力：系统调用回调 KeSetSystemServiceCallback、内核态 ETW 事件回调 EtwRegisterEventCallback、追踪点 KeSetTracepoint。",
      "status": "unknown",
      "growth_signal": "追踪能力（系统调用/内核事件/tracepoint）的系统性记录与发布，与提权研究互补：先建立对内核可观测面的结构化掌握，再据此构造或防御利用原语；作者将此称为\"每个 Windows 安全研究员的第二个圣诞愿望\"，显示其工作节奏跟随系统版本演进持续更新认知。",
      "source": {
        "title": "Dynamic Tracing in Windows 10 19H1",
        "url": "https://www.alex-ionescu.com/dynamic-tracing-in-windows-10-19h1/",
        "published": "2018-08-02",
        "source_type": "blog_post",
        "level": "lead_only"
      },
      "verification": {
        "verified_in_run": false,
        "retrieval_method": "unverified",
        "tool_use_id": "",
        "accessed_at": "",
        "content_sha256": ""
      }
    },
    {
      "id": "ai-works-04",
      "date": "2019-01-14",
      "claim": "在 Hyper-V 模糊测试桥系列 Part 1 中记述自建 WDF root-enumerated 驱动 vtlbrdge.sys（IOCTL_ISSUE_HYPER_CALL），从传统 WDM 非 PnP 迁移到 WDF PnP 写法，并说明动机是为从用户态与 Hyper-V/Secure Kernel 通信以进行模糊测试。",
      "status": "documented",
      "growth_signal": "为研究目标自建配套基础设施（驱动+用户态客户端+INF），并主动复盘旧假设（曾误以为 WDM 更适合研究型驱动）以采用更省力的 WDF 写法，反映\"按需造工具→修正方法论→沉淀为可复用资产\"的迭代；作者表示工具将在\"打磨完善后\"发布到 GitHub，体现公开发表的延迟-打磨习惯。",
      "short_quote": "I had wrongly assumed that for writing Non-PnP research/academic drivers... WDM was still the better, and easier choice.",
      "source": {
        "title": "Writing a Hyper-V \"Bridge\" for Fuzzing — Part 1: WDF",
        "url": "https://www.alex-ionescu.com/writing-a-hyper-v-bridge-for-fuzzing-part-1-wdf/",
        "published": "2019-01-14",
        "source_type": "blog_post",
        "level": "primary"
      },
      "verification": {
        "verified_in_run": true,
        "retrieval_method": "web_fetch",
        "tool_use_id": "call_tp9yxirspld2v0qlmondei5u",
        "accessed_at": "2026-09-27T06:57:34.773548+00:00",
        "content_sha256": "092017feb72c930ced12665ca84d3404023d979467632085748a7b0819f34316"
      }
    },
    {
      "id": "ai-works-05",
      "date": "2019-01-27",
      "claim": "Hyper-V 模糊测试桥系列 Part 2 续写 hypercalls 与 MDL 处理，延续 Part 1 的驱动框架。",
      "status": "unknown",
      "growth_signal": "系列化写作将一项研究拆分为可独立消化的小步交付（Part 1 框架、Part 2 内部机制），降低读者门槛并体现对自身技术叙事节奏的控制。",
      "source": {
        "title": "Writing a Hyper-V \"Bridge\" for Fuzzing — Part 2: Hypercalls & MDLs",
        "url": "https://www.alex-ionescu.com/writing-a-hyper-v-bridge-for-fuzzing-part-2-hypercalls-mdls/",
        "published": "2019-01-27",
        "source_type": "blog_post",
        "level": "lead_only"
      },
      "verification": {
        "verified_in_run": false,
        "retrieval_method": "unverified",
        "tool_use_id": "",
        "accessed_at": "",
        "content_sha256": ""
      }
    },
    {
      "id": "ai-works-06",
      "date": "2016",
      "claim": "GitHub 仓库 SimpleVisor（Intel VT-x 精简 hypervisor，10 行汇编）版权标注 2016，README 阐述设计目标为最小化汇编与最小 VMX 代码，支持 hyperjacking/unhyperjacking，并明确警示其不做错误校验、非生产级。",
      "status": "documented",
      "growth_signal": "以\"最小可用实现\"为原则公开研究型 hypervisor，作为他人理解 VT-x 基础的基线（README 对比 HyperPlatform 的\"臃肿\"），体现\"可教学的最小工具\"建设取向；显式声明不适用于生产，区分研究工具与产品代码。",
      "source": {
        "title": "ionescu007/SimpleVisor (GitHub)",
        "url": "https://github.com/ionescu007/SimpleVisor",
        "published": "2016",
        "source_type": "code_repository",
        "level": "primary"
      },
      "verification": {
        "verified_in_run": true,
        "retrieval_method": "web_fetch",
        "tool_use_id": "call_xz8xf4mrfsqvvv8x7hsukygi",
        "accessed_at": "2026-09-27T06:57:34.773569+00:00",
        "content_sha256": "493567ee4022188914ff2489906cdff5c10c362a9f43f6a2f1a78cea3dbb45ae"
      }
    },
    {
      "id": "ai-works-07",
      "date": "unknown",
      "claim": "GitHub pinned 仓库集合含 VisualUefi（EDK-II + Visual Studio 开发）、lxss（WSL/LXSS 内部研究）、HookingNirvana（Recon 2015 演讲资料）、smctool（Apple SMC 工具）、SpecuCheck（Meltdown/Spectre v2/Foreshadow 缓解检测工具），覆盖 UEFI 固件、WSL、Apple 硬件与侧信道缓解多个技术栈。",
      "status": "documented",
      "growth_signal": "工具建设横跨 VT-x、UEFI、WSL、Apple SMC、侧信道缓解检测等多个底层方向，显示其技术栈随公开议题（如 SpecuCheck 对应 2018 年侧信道披露潮）动态扩展；研究产出常以可发布工具形式固化。",
      "source": {
        "title": "ionescu007 GitHub profile (pinned repositories)",
        "url": "https://github.com/ionescu007",
        "published": "unknown",
        "source_type": "code_repository",
        "level": "primary"
      },
      "verification": {
        "verified_in_run": true,
        "retrieval_method": "web_fetch",
        "tool_use_id": "call_iw7yf7m3nu9ffaq75za73miu",
        "accessed_at": "2026-09-27T06:57:34.773555+00:00",
        "content_sha256": "6aeac6a355625aabae4242efd59b4642e4eeb984a145c77363b875c8c1ca6ad1"
      }
    },
    {
      "id": "ai-works-08",
      "date": "2017",
      "claim": "GitHub 个人简介与主站交叉确认其职业身份为 CrowdStrike CTIO、Winsider Seminars & Solutions 总裁，并维护 windows-internals.com 培训站点。",
      "status": "documented",
      "growth_signal": "职业身份与培训业务（Winsider/windows-internals.com）并行，反映其将内核知识结构化为可交付培训的二次产出路径，构成研究→教学→写作的循环。",
      "source": {
        "title": "ionescu007 GitHub profile (bio)",
        "url": "https://github.com/ionescu007",
        "published": "unknown",
        "source_type": "code_repository",
        "level": "primary"
      },
      "verification": {
        "verified_in_run": true,
        "retrieval_method": "web_fetch",
        "tool_use_id": "call_iw7yf7m3nu9ffaq75za73miu",
        "accessed_at": "2026-09-27T06:57:34.773555+00:00",
        "content_sha256": "6aeac6a355625aabae4242efd59b4642e4eeb984a145c77363b875c8c1ca6ad1"
      }
    }
  ],
  "contradictions": [
    "person_json 将 \"Black Hat US/EU / BlueHat\" 列为 selected_conference_evidence，但主站 /publications 页为跳转页（指向 GitHub 与博客分类），未直接列出会议条目；WebSearch 亦未返回可抓取的 Black Hat 归档页面，会议履历暂无一手可核证来源，仅为人物记录转述，未升级为 documented。"
  ],
  "gaps": [
    "ReactOS 早期项目角色（常见传记叙述称其为 lead developer/early contributor）在主站可见页面无提及，WebSearch 未返回可抓取来源；该阶段作品与时间线无法核证，留空。",
    "早期 Black Hat / BlueHat 演讲（含 person_json 所列 Black Hat US/EU）无主站一手列表，亦无可抓取会议归档页；最早可核证会议作品为 Recon 2015（HookingNirvana 仓库标题）、Infiltrate 2015（AWE 攻击，主站 call-gates 文引用）、SyScan 360 2017、Recon 2017（SAM），未进入 items 因正文未独立抓取。",
    "SimpleVisor 仅获版权年份 2016，未取得仓库首次提交/最后更新的精确日期。",
    "Hyper-V 桥系列作者自述\"将在打磨后发布完整工具到 GitHub\"，是否最终发布、对应仓库与发布日期未核证。",
    "主站列出博客存档跨度 2006-11 至 2019-01（\"Articles and Presentations\" 类目 15 篇），但早期 2006-2007 年文章正文未抓取，2007 年 1 月 9 篇与 2006 年 11 月 10 篇的具体技术演化未纳入。",
    "无公开 CVE/公告编号的核证来源；call-gates 系列作者明确声明非漏洞/0day，主站未列独立 advisory 编号清单。"
  ],
  "_run": {
    "pipeline_version": 2,
    "output_recovery_version": 4,
    "sub_workspace": "/Users/c0ss4ck/Projects/C0ss4ck/ZeroMDASH/research/runs/sub_workspace/alex-ionescu-works-20260927-145325-454",
    "raw_response_path": "/Users/c0ss4ck/Projects/C0ss4ck/ZeroMDASH/research/runs/responses/1790492254769802000-alex-ionescu-works.json",
    "resume_response_paths": [],
    "recovery_response_path": null,
    "output_source": "artifact",
    "session_id": "39d38838-b423-4999-ae4e-3f3b938453da",
    "tool_receipts": [
      {
        "tool_use_id": "call_n5u94hnjs5piosvvx8edcryv",
        "tool": "Read",
        "input": {